{
  "tenant_id": "tenant-acme",
  "observation_type": "deployment",
  "repository_full_name": "acme-org/storefront",
  "source_url": "https://github.com/acme-org/storefront/deployments/12345",
  "last_synced_at": "2026-09-19T01:05:00Z",
  "resource": {
    "id": 12345,
    "environment": "production",
    "state": "success"
  }
}
